{
  "planName": "饮食健康处方",
  "planTitle": "控糖减重·夜班友好饮食方案",
  "planSummary": "这份方案围绕降低餐后血糖、帮助减重、改善饮食习惯来设计。考虑到你近期夜班多、常吃外卖，方案会重点帮你解决：主食怎么吃血糖更稳、外卖和食堂怎么选、夜班期间怎么加餐不升糖。接下来会围绕这些方向给出具体可执行的建议和一周菜谱。",
  "executionPoints": "优先落实重点执行条目，先从调整早餐和晚餐主食份量开始，逐步替换外卖选择；饮食调整以循序渐进、可长期坚持为原则；注意随餐或餐后服药，避免空腹服药引起胃部不适；如出现明显不适、连续血糖偏高或偏低、体重下降过快，应及时联系医生或健管师；建议每周称一次体重、记录2-3天饮食和血糖，方便后续调整。",
  "groups": [
    {
      "groupTitle": "主食与血糖管理",
      "groupType": "adviceList",
      "groupSummary": "控制主食种类和份量，降低餐后血糖峰值，是当前饮食干预的第一优先级。",
      "displayStyle": "list",
      "dietPlanGoalLabel": "",
      "goalBasis": "",
      "items": [
        {
          "itemType": "advice",
          "day": "",
          "title": "每餐主食固定为1-1.5拳头",
          "content": "每餐主食约1-1.5个拳头大小（煮熟后约150-225克），优先选择糙米、燕麦、全麦面包、杂豆或薯类，替代白米饭、白面条、包子、油条。",
          "focusPoint": "您近期晚餐后血糖高达19.5 mmol/L，控制目标为餐后<10 mmol/L。减少精制碳水和增加膳食纤维可显著降低餐后血糖波动。如果出现胃肠不适，可先替换一半粗粮。",
          "importance": "重点执行",
          "dailyTotalKcal": "",
          "dailyTotalProteinG": "",
          "dailyTotalFatG": "",
          "estimatedEnergyDeficitKcal": "",
          "meals": []
        },
        {
          "itemType": "advice",
          "day": "",
          "title": "改变进餐顺序：先菜后肉再主食",
          "content": "每顿饭先吃蔬菜（至少半碗），再吃蛋白质（肉/蛋/豆制品），最后吃主食。",
          "focusPoint": "这种顺序可以延缓葡萄糖吸收，降低餐后血糖峰值，同时增加饱腹感。医院食堂和外卖均可执行。",
          "importance": "重点执行",
          "dailyTotalKcal": "",
          "dailyTotalProteinG": "",
          "dailyTotalFatG": "",
          "estimatedEnergyDeficitKcal": "",
          "meals": []
        }
      ]
    },
    {
      "groupTitle": "外食与夜班饮食策略",
      "groupType": "adviceList",
      "groupSummary": "针对外卖频率高、夜班作息不规律的特点，提供具体可执行的选择规则和加餐方案。",
      "displayStyle": "list",
      "dietPlanGoalLabel": "",
      "goalBasis": "",
      "items": [
        {
          "itemType": "advice",
          "day": "",
          "title": "外卖/食堂选择指南",
          "content": "选清蒸、凉拌、白灼、炖煮类菜品（如清蒸鱼、凉拌黄瓜、白灼虾），避免油炸、红烧、糖醋、勾芡类（如糖醋里脊、鱼香肉丝、地三鲜）。主食备注“少米饭”或“米饭减半”。",
          "focusPoint": "您总胆固醇6.5 mmol/L，需同时限制饱和脂肪和反式脂肪。外卖备注“少盐少油”，每日盐<5g（约一啤酒瓶盖）。",
          "importance": "重点执行",
          "dailyTotalKcal": "",
          "dailyTotalProteinG": "",
          "dailyTotalFatG": "",
          "estimatedEnergyDeficitKcal": "",
          "meals": []
        },
        {
          "itemType": "advice",
          "day": "",
          "title": "夜班饮食时间表",
          "content": "上班前吃一顿均衡正餐（蔬菜+蛋白质+主食），中途（约凌晨1-2点）加餐一次（如无糖酸奶+一小把坚果/全麦饼干），下班后吃简易早餐（如燕麦牛奶+鸡蛋），避免空腹超过6小时。",
          "focusPoint": "夜班打乱进餐节奏易导致血糖波动和暴食。设置手机闹钟提醒进餐时间。如用药时间需调整，请咨询医生。",
          "importance": "重点执行",
          "dailyTotalKcal": "",
          "dailyTotalProteinG": "",
          "dailyTotalFatG": "",
          "estimatedEnergyDeficitKcal": "",
          "meals": []
        },
        {
          "itemType": "advice",
          "day": "",
          "title": "建立规律早餐",
          "content": "每天固定时间吃早餐，推荐5分钟快手组合：1个水煮蛋+1片全麦面包+1杯无糖豆浆/牛奶+几片黄瓜/番茄。",
          "focusPoint": "您目前常不吃早餐或吃包子油条，易导致午餐暴食和血糖飙升。规律早餐可稳定全天血糖，且与用药时间（8am）配合。",
          "importance": "常规建议",
          "dailyTotalKcal": "",
          "dailyTotalProteinG": "",
          "dailyTotalFatG": "",
          "estimatedEnergyDeficitKcal": "",
          "meals": []
        }
      ]
    },
    {
      "groupTitle": "控油控盐与减重",
      "groupType": "adviceList",
      "groupSummary": "减少总热量和钠摄入，促进减重和血脂控制。",
      "displayStyle": "list",
      "dietPlanGoalLabel": "",
      "goalBasis": "",
      "items": [
        {
          "itemType": "advice",
          "day": "",
          "title": "每日总热量控制在1500-1700千卡",
          "content": "按照估算，每日热量约1500-1700千卡（蛋白质60-80克，脂肪40-50克，碳水150-180克）。可参考：早餐约400千卡，午餐约600千卡，晚餐约500千卡，加餐约100-200千卡。",
          "focusPoint": "此热量基于您身高约1.70米估算，设置温和缺口以减重。每周称重1次，如体重下降过快或过慢，可调整100-200千卡。",
          "importance": "重点执行",
          "dailyTotalKcal": "",
          "dailyTotalProteinG": "",
          "dailyTotalFatG": "",
          "estimatedEnergyDeficitKcal": "",
          "meals": []
        },
        {
          "itemType": "advice",
          "day": "",
          "title": "减少高盐高脂食物",
          "content": "避免肥肉、动物内脏、加工肉制品（香肠、培根）、油炸食品和含糖饮料。选择瘦肉、去皮禽肉、鱼类。外卖额外备注“少盐”。",
          "focusPoint": "您合并高血压和周围血管病变，每日盐<5g。高脂食物会增加总胆固醇和内脏脂肪。",
          "importance": "常规建议",
          "dailyTotalKcal": "",
          "dailyTotalProteinG": "",
          "dailyTotalFatG": "",
          "estimatedEnergyDeficitKcal": "",
          "meals": []
        },
        {
          "itemType": "advice",
          "day": "",
          "title": "饭后散步10分钟",
          "content": "每餐后休息5分钟，再散步10分钟（约500-800步）。",
          "focusPoint": "您目前运动量较少（每日约3000步），饭后短时散步有助于降低餐后血糖，且不增加关节负担。如天气或夜班不便，可在室内原地踏步。",
          "importance": "补充建议",
          "dailyTotalKcal": "",
          "dailyTotalProteinG": "",
          "dailyTotalFatG": "",
          "estimatedEnergyDeficitKcal": "",
          "meals": []
        }
      ]
    },
    {
      "groupTitle": "安全与监测提醒",
      "groupType": "adviceList",
      "groupSummary": "确保饮食调整与用药、指标监测协同，避免风险。",
      "displayStyle": "list",
      "dietPlanGoalLabel": "",
      "goalBasis": "",
      "items": [
        {
          "itemType": "advice",
          "day": "",
          "title": "随餐服药，避免空腹",
          "content": "吡格列酮二甲双胍片随餐或餐后服用，不要空腹服药。如果夜班打乱作息，确保服药前已进食少量食物。",
          "focusPoint": "二甲双胍可能引起胃肠道反应，随餐可减轻不适。您无低血糖史，但调整饮食后仍需注意，如出现头晕、心慌，立即测血糖并进食。",
          "importance": "重点执行",
          "dailyTotalKcal": "",
          "dailyTotalProteinG": "",
          "dailyTotalFatG": "",
          "estimatedEnergyDeficitKcal": "",
          "meals": []
        },
        {
          "itemType": "advice",
          "day": "",
          "title": "定期监测血糖和体重",
          "content": "每周至少测2次空腹血糖和2次餐后血糖（重点测晚餐后），每周称体重1次。记录在手机或本子上。",
          "focusPoint": "目前缺乏近期糖化血红蛋白和血脂全套结果，建议1-2个月内复查。如血糖持续不达标或体重不降，需进一步调整方案。",
          "importance": "常规建议",
          "dailyTotalKcal": "",
          "dailyTotalProteinG": "",
          "dailyTotalFatG": "",
          "estimatedEnergyDeficitKcal": "",
          "meals": []
        }
      ]
    },
    {
      "groupTitle": "最近7天饮食执行菜谱",
      "groupType": "weeklyMealPlan",
      "groupSummary": "最近7天三餐执行安排。",
      "displayStyle": "weeklyMealPlan",
      "dietPlanGoalLabel": "减重控糖",
      "goalBasis": "本次方案要求同时控制血糖、减重、改善饮食习惯，且患者有糖尿病、高脂血症、中心性肥胖，近期餐后血糖高达19.5 mmol/L，体重83.4 kg，腰围107 cm，内脏脂肪等级15。",
      "items": [
        {
          "itemType": "dailyMealPlan",
          "day": 1,
          "title": "第1天",
          "content": "控糖减重基础日，建立规律三餐",
          "focusPoint": "全天约1550千卡，预计形成约450千卡热量缺口；早餐必须吃，晚餐控制主食量。",
          "importance": "重点执行",
          "dailyTotalKcal": 1550,
          "dailyTotalProteinG": 82,
          "dailyTotalFatG": 42,
          "estimatedEnergyDeficitKcal": 450,
          "meals": [
            {
              "mealName": "早餐",
              "mealScene": "快手早餐",
              "mealTotalKcal": 380,
              "mealTotalProteinG": 22,
              "mealTotalFatG": 12,
              "foods": [
                {
                  "name": "无糖燕麦片",
                  "amountG": 40,
                  "kcal": 150,
                  "proteinG": 5,
                  "fatG": 3
                },
                {
                  "name": "纯牛奶（250ml）",
                  "amountG": 250,
                  "kcal": 135,
                  "proteinG": 8,
                  "fatG": 8
                },
                {
                  "name": "煮鸡蛋（带壳）",
                  "amountG": 60,
                  "kcal": 90,
                  "proteinG": 7,
                  "fatG": 6
                },
                {
                  "name": "小番茄",
                  "amountG": 50,
                  "kcal": 10,
                  "proteinG": 0,
                  "fatG": 0
                }
              ]
            },
            {
              "mealName": "午餐",
              "mealScene": "食堂可选",
              "mealTotalKcal": 520,
              "mealTotalProteinG": 30,
              "mealTotalFatG": 14,
              "foods": [
                {
                  "name": "糙米饭",
                  "amountG": 150,
                  "kcal": 180,
                  "proteinG": 4,
                  "fatG": 1
                },
                {
                  "name": "清蒸鱼（鲈鱼，去骨）",
                  "amountG": 100,
                  "kcal": 110,
                  "proteinG": 20,
                  "fatG": 3
                },
                {
                  "name": "蒜蓉西兰花",
                  "amountG": 200,
                  "kcal": 70,
                  "proteinG": 5,
                  "fatG": 2
                },
                {
                  "name": "凉拌黄瓜（少油）",
                  "amountG": 100,
                  "kcal": 20,
                  "proteinG": 1,
                  "fatG": 0
                }
              ]
            },
            {
              "mealName": "晚餐",
              "mealScene": "外卖可选",
              "mealTotalKcal": 480,
              "mealTotalProteinG": 24,
              "mealTotalFatG": 14,
              "foods": [
                {
                  "name": "全麦馒头（小）",
                  "amountG": 75,
                  "kcal": 160,
                  "proteinG": 6,
                  "fatG": 2
                },
                {
                  "name": "白切鸡（去皮）",
                  "amountG": 80,
                  "kcal": 130,
                  "proteinG": 16,
                  "fatG": 4
                },
                {
                  "name": "清炒小白菜",
                  "amountG": 250,
                  "kcal": 60,
                  "proteinG": 4,
                  "fatG": 2
                },
                {
                  "name": "凉拌豆腐（内酯豆腐）",
                  "amountG": 100,
                  "kcal": 70,
                  "proteinG": 6,
                  "fatG": 3
                }
              ]
            },
            {
              "mealName": "夜班加餐",
              "mealScene": "夜班中途加餐",